{
  "id": "cccccccc-0000-4000-8000-000000000001",
  "uri": "https://grip.opdrachtnemer.example/id/offerte/cccccccc-0000-4000-8000-000000000001",
  "assignment_uri": "https://grip.opdrachtnemer.example/id/opdracht/dddddddd-0000-4000-8000-000000000001",
  "request_id": null,
  "contractor": {
    "tooi_uri": "https://identifier.overheid.nl/tooi/id/oorg/oorg00000",
    "name": "Voorbeelddienst",
    "unit_key": "voorbeeldgilde",
    "instance_uri": "https://grip.opdrachtnemer.example"
  },
  "client": {
    "tooi_uri": "https://identifier.overheid.nl/tooi/id/ministerie/mnre0000",
    "name": "Voorbeeldministerie",
    "unit_key": "directie-voorbeeld",
    "instance_uri": "https://grip.opdrachtgever.example"
  },
  "parent_assignment_uri": null,
  "snapshot": {
    "name": "Voorstel Delta",
    "context_refs": [],
    "lines": [
      {
        "position": 1,
        "description": "Productmanager",
        "kind": "personnel",
        "role": "Productmanager",
        "fte": "0.8",
        "rate_category": "D",
        "period": {
          "start_date": "2026-07-01",
          "end_date": "2026-12-31"
        },
        "monthly_rate": {
          "amount_cents": 1800000,
          "currency": "EUR"
        },
        "amount": {
          "amount_cents": 8640000,
          "currency": "EUR"
        }
      },
      {
        "position": 2,
        "description": "Hosting",
        "kind": "fixed",
        "amount": {
          "amount_cents": 1500000,
          "currency": "EUR"
        }
      }
    ],
    "subtotals_per_year": [
      {
        "year": 2026,
        "amount": {
          "amount_cents": 10140000,
          "currency": "EUR"
        }
      }
    ],
    "total": {
      "amount_cents": 10140000,
      "currency": "EUR"
    },
    "valid_until": "2026-06-30",
    "conditions": "Fictieve voorwaarden."
  },
  "snapshot_hash": "416ac16ed465cca235eba9933b571ab0d26f1d7f30679d2ab80c541d3a97541e",
  "hash_algorithm": "sha-256",
  "canonicalization": "RFC8785",
  "issued_at": "2026-06-01T10:00:00+02:00"
}
