{
  "id": "9d3b6c0e-2f41-4c8a-b0d2-6a1f5e7c8b90",
  "uri": "https://grip.opdrachtnemer.example/id/offerte/9d3b6c0e-2f41-4c8a-b0d2-6a1f5e7c8b90",
  "assignment_uri": "https://grip.opdrachtgever.example/id/opdracht/3f2a8c54-6d1b-4f0e-9a77-1c2b3d4e5f60",
  "request_id": "1a2b3c4d-0000-4000-8000-000000000001",
  "contractor": {
    "tooi_uri": "https://identifier.overheid.nl/tooi/id/oorg/oorg00000",
    "name": "Voorbeelddienst",
    "unit_key": "voorbeeldgilde",
    "instance_uri": "https://grip.opdrachtnemer.example"
  },
  "client": {
    "tooi_uri": "https://identifier.overheid.nl/tooi/id/ministerie/mnre0000",
    "name": "Voorbeeldministerie",
    "unit_key": "directie-voorbeeld",
    "instance_uri": "https://grip.opdrachtgever.example"
  },
  "parent_assignment_uri": null,
  "snapshot": {
    "name": "Opdracht Alfa",
    "context_refs": [
      "https://corpus.voorbeeldministerie.example/id/node/0b6f1c1e-5a0e-4a53-9a43-0d3e1d6b2a03"
    ],
    "lines": [
      {
        "position": 1,
        "description": "Productmanager",
        "kind": "personnel",
        "role": "Productmanager",
        "fte": "0.8",
        "rate_category": "D",
        "period": {
          "start_date": "2026-07-01",
          "end_date": "2026-12-31"
        },
        "monthly_rate": {
          "amount_cents": 1800000,
          "currency": "EUR"
        },
        "amount": {
          "amount_cents": 8640000,
          "currency": "EUR"
        }
      },
      {
        "position": 2,
        "description": "Hosting",
        "kind": "fixed",
        "amount": {
          "amount_cents": 1500000,
          "currency": "EUR"
        }
      }
    ],
    "subtotals_per_year": [
      {
        "year": 2026,
        "amount": {
          "amount_cents": 10140000,
          "currency": "EUR"
        }
      }
    ],
    "total": {
      "amount_cents": 10140000,
      "currency": "EUR"
    },
    "valid_until": "2026-06-30",
    "conditions": "Fictieve voorwaarden."
  },
  "snapshot_hash": "80cf1b6e929ab9e4885bddd6a14ea3064c4d83ca190b2eae92c455befc1694a4",
  "hash_algorithm": "sha-256",
  "canonicalization": "RFC8785",
  "issued_at": "2026-06-01T10:00:00+02:00"
}
